国际,快讯！CNN曝：拜登身边助手新冠检测呈阳性，目前留在苏格兰隔离,https://world.huanqiu.com//article/45SUtGiTu98,"
【环球网快讯】美国有线电视新闻网（CNN）当地时间4日消息，一位白宫官员4日证实，一位曾跟随拜登外访参加第26届联合国气候变化大会的白宫助手新冠检测呈阳性，目前留在苏格兰进行隔离。
报道称，出于隐私考虑，白宫没有透露这位助手的名字。2日，也就是拜登参加格拉斯哥气候大会的最后一天，这位助手新冠检测结果呈阳性。
报道称，证实该消息的白宫官员表示，“这名助手与拜登没有密切接触，也没有出现任何感染症状。”“他已留在苏格兰，以完成隔离期。”
CNN提到，此前有官员表示，“拜登在2日的新冠检测中结果呈阴性。”",2021-11-05 10:14,环球网
国际,俄罗斯“天狼星-2021”密闭空间国际实验启动,https://world.huanqiu.com//article/45SUn1fZJ2D,"
4日，俄罗斯“天狼星-2021”密闭空间国际实验在莫斯科启动。该实验将模拟往返月球的全过程。实验期间，志愿者还将模拟“出舱”，实现在月球表面的虚拟着陆。
实验的主办方表示，本次实验的六名志愿者分别来自俄罗斯、美国和阿联酋。
为期240天的实验分为飞抵月球、绕月飞行寻找着陆点、虚拟出舱以及返回地球几个阶段。其中，执行出舱任务的志愿者还将进行月球土壤收集并操控月球车。在整个实验期间，志愿者可以与实验指挥中心进行语音联系，也能通过电子邮件和家人、亲友联系。
“天狼星”密闭空间国际实验是在2017年启动的一个长期项目，从地球上看，天狼星是夜空中最亮的恒星之一。研究者们认为，这个名字预示着将来有一天人类可以完成长距离宇宙飞行，抵达更加遥远的星体。
“天狼星”密闭空间国际实验的目的是什么？从2017年到现在，这个项目又取得了哪些成果？来看总台记者的观察。
为了实现探索宇宙的梦想，人类需要做许多准备。在模拟太空飞行的密闭空间进行长期实验就是其中的一项。多年来，俄罗斯一直在从事相关的实践。11年前的“火星-500”、6年前的“月球-2015项目”都给我们留下了深刻的印象。
而现在实验的目的是在地面上模拟太空中的环境，了解长期密闭环境下乘组人员健康状态及工作能力状况。为将来的载人探月、探索火星飞行做准备。
6年前，库斯玛乌丽通过选拔，成为“月球-2015”项目的成员。她和其他5名俄罗斯女性科研工作者在模拟月球飞行器的密闭空间里待了8天。这段时间正好就是俄罗斯可以从其东方航天发射场发射飞船，绕月球飞行一周的时间。
库斯玛乌丽说，在密闭航天器里隔离与我们在疫情之下的隔离不同，需要承受巨大的心理和生理压力。她说，她有一个探索宇宙的梦想，这也是全人类共同的梦想。她相信，在各国科学家的共同努力下，未来人类必将获得更多宇宙的奥秘。",2021-11-05 10:11,央视新闻
国际,韩国总统选举上演“四强争霸” 最大在野党候选人即将揭晓,https://world.huanqiu.com//article/45SUTTc6IGe,"
李在明（左）与文在寅
韩国前检察总长尹锡悦
韩国国民力量党共有4名初步候选人，分别是前检察总长尹锡悦、国会议员洪准杓、前国会议员刘承旼和前济州道知事元喜龙。其中，尹锡悦和洪准杓的呼声最高，两人难分伯仲，选情胶着。
韩国国会议员洪准杓
韩联社称，5日下午，国民力量党候选人诞生后，将与执政的共同民主党总统候选人李在明开展正面交锋。加上国民之党候选人安哲秀和正义党候选人沈相奵，本届韩国大选将形成4人角逐的局面。韩国纽西斯通讯社则指出，考虑到独立参选的韩国前经济副总理金东兖为大选增加了一些变数，此次大选也可能上演“五强争霸”。（海外网 刘强）",2021-11-05 10:02,海外网
国际,全球连线|微视频：四叶草 连五洲,https://world.huanqiu.com//article/45SUICRwtsr,"
策划：刘健 姜微 徐姗娜 钱彤
监制：班玮 刘加文 肖春飞
执行策划：夏小鹏 马轶群 徐倩 汤丹鹭
统筹：杨金志 林艳兴
编导：董小娇 王俊景 吴轶楠
后期：李科燊 旷思琦
编辑：刘小军 周蕊 严曦梦 徐昌敏
新华网股份有限公司、新华社上海分社制作
新华社国际传播融合平台出品",2021-11-05 09:57,新华网
国际,国际锐评｜对核潜艇事故遮遮掩掩 做贼心虚的美军到底想隐瞒什么？,https://world.huanqiu.com//article/45SUHtOYPQB,"
美国海军日前发布“康涅狄格”号核潜艇撞击调查报告，称该潜艇因撞击一座“不知名的海底山”而严重受损。然而，这份姗姗来迟的报告，对该潜艇的航行意图、事故发生地点、是否造成核泄漏、是否破坏南海地区海洋环境等关键问题没有做出明确说明。人们不禁要问，美军如此遮遮掩掩，是不是做贼心虚？他们到底在隐瞒什么？
事实上，自“康涅狄格”号核潜艇10月2日发生碰撞事故以来，此事就疑点重重。外界注意到，事故发生5天后，美国太平洋舰队才发布声明证实事故的发生。事故发生后近一个月，美军又说撞上了不知名的海底山。一贯“消息灵通”的美国媒体，这次也没有披露更多详细信息，甚至连“康涅狄格”号返修的最新照片都没给出。
事出反常必有妖。为维护南海地区的和平稳定与国际航路安全，美方必须回答外界最关注的两个问题：
首先，“康涅狄格”号核潜艇究竟所为何来？
近年来，美国推进所谓“印太战略”，打着“航行自由”旗号在南海地区从事高密度军事活动。今年以来，美军对华抵近侦察的强度明显增强。相关统计显示，截至7月底，美军对华海空抵近侦察已接近2000次。明眼人都看得出，美国不愿看到中国与南海周边国家就管控分歧达成共识，借打“南海牌”在地区挑拨离间，企图把南海之水搅浑，为其在亚太地区部署更多军事力量寻找口实。
“康涅狄格”号作为美军最先进的“海狼”级核潜艇，具备强大的攻击能力和侦察能力。它这次跑到南海，显然没安什么好心。一些分析认为，在中美博弈加剧的大背景下，“康涅狄格”号是为窥探更多中国南海地区的军事情报信息而来。更有人质疑，美战略核潜艇此前到底来过南海多少次？
其次，“康涅狄格”号核潜艇碰撞事故是否造成了核泄漏？
外界注意到，事故发生后，美国太平洋舰队曾发表声明称，该潜艇核动力装置没有受到影响，仍然正常运行。但蹊跷的是，美军日前派出WC-135w核侦察机到南海侦测。《南华早报》推测，此举是为调查潜艇碰撞事故是否引发了核泄漏。
另外，鉴于美军曾多次发生核事故的“黑历史”，人们也有理由产生怀疑。根据公开资料，1946年至1958年间，美国在马绍尔群岛进行了67次核武器试验，特别是1954年美国在比基尼岛进行的氢弹试验，造成了太平洋上最严重的核污染事件。据媒体披露，1965年至1983年，美国曾发生核武器特大事故共计233起。作为核安全记录非常糟糕的国家，美方必须拿出证据，向外界解释事发周边海域的环境情况。
“美国军方从未讲过真话。”——这是一位网友在社交媒体上的留言。确实，从遍布全球的200多个美军生物实验室秘而不宣，到将在阿富汗炸死平民事件粉饰成“反恐”，美军编造谎言、掩盖真相的前科累累，其形象早与“不负责、不透明、不可信”挂钩。
此次“康涅狄格”号核潜艇碰撞事故的发生，再次让国际社会看清美军所谓“航行自由”幌子下的美式霸权，看清竭力渲染他国威胁的全球唯一超级大国，正是南海军事化的最大推手，是破坏南海和平稳定的最大祸源。围绕这起事故的重重疑点，全世界都在盯着看，美军休想装聋作哑，必须给出一个交代！",2021-11-05 09:57,央视新闻
国际,美军没有违法？阿富汗民众表示无法接受,https://world.huanqiu.com//article/45SUGJgQU42,"
8月29日，美军在阿富汗首都喀布尔实施无人机空袭，导致37岁的人道主义援助机构工作者 泽梅莱·艾哈麦迪及其9名家人死亡，其中包括7名儿童。迫于舆论压力，美国国防部9月宣布对这起事件展开审查。
日前，美国军方的内部审查结果出炉。在10个逝去的无辜生命面前，美军的审查报告居然辩称此次袭击中“无人行为不当、无人违法”。报告也没有建议对当事人采取任何惩戒性的措施。这意味着，没有人会因为这起事件而被追责。
对于美国军方内部审查得出的这样一个结论，总台报道员在阿富汗首都喀布尔街头采访了多位阿富汗民众，他们都表示这样的审查结果不能接受。
在阿富汗首都喀布尔，不少民众听闻美国空军督察长赛义德认为“喀布尔无人机袭击”没有违反战争法的言论后感到气愤，质问美国凭什么在犯下累累罪行后，还能成为法外之地。
喀布尔市民萨贾迪表示，现在美军说没有违反战争法，但他们确实违反了，他们杀了10个人是为了什么？现在他们还说没有违反战争法。
喀布尔市民多斯特说，美国杀了很多人，他们杀了妇女和儿童，摧毁了阿富汗。他们用炸弹和无人机袭击，杀死了许多人 。
阿富汗民众表示，这不是美国第一次杀害阿富汗平民，但美国却从没有受到过处罚。",2021-11-05 09:56,央视新闻
国际,联合国发布《2021年适应差距报告》 发达国家应承担更多责任,https://world.huanqiu.com//article/45STq2K3q5Q,"
4日，正在英国格拉斯哥举行的《联合国气候变化框架公约》第二十六次缔约方大会期间，联合国环境规划署发布了最新的《2021年适应差距报告》。报告认为，虽然气候适应措施正越来越多地融入各国的政策和规划中，但气候适应融资的规模迫切需要加强，特别是发展中国家。目前，发展中国家的气候适应成本是当前公共气候适应资金流的5到10倍，而且适应资金缺口正在扩大，全球亟须大幅提高相应的额度。
报告指出，为应对气候变化带来的挑战，除了减少排放、减缓全球变暖的速度之外，还必须适应气候变化的后果，如火灾、洪水、干旱或海平面上升等，因此，建立有效的早期预警系统、完善具有气候韧性的基础设施等至关重要。
报告认为，新冠肺炎疫情直接影响了全球对气候变化适应的规划和资金支持，而目前，发达国家承诺支持发展中国家的资金中，只有20%用于气候适应领域，这远远不够。
英国气候变化委员会执行主任克里斯·斯塔克在接受采访时表示，从历史上来看，很多发达国家的活动是气候变化的主要原因，但气候变化的影响却大多集中在发展中国家，因此发达国家应该在这一议题上承担更多责任。",2021-11-05 09:44,央视新闻
国际,新西兰北岛东部遭遇极端天气,https://world.huanqiu.com//article/45SThZffXTE,"
据新西兰媒体报道，当地时间11月4日到5日，新西兰北岛东部地区遭遇极端天气，暴雨引发了洪水和滑坡，东部城市吉斯伯恩宣布进入紧急状态，部分地区居民被转移。
气象部门称，未来几天这一地区还有强降雨，应急部门警告可能有更多建筑和道路面临洪水威胁。（总台记者 林清辉）",2021-11-05 09:41,央视新闻
国际,拜登随行助手感染新冠 在英国被就地隔离,https://world.huanqiu.com//article/45SS27Ekw5t,"
白宫（资料图）
一名白宫官员表示，当地时间2日，这名随行助手的快速检测结果呈阳性，正在等待后续的PCR检测结果。这名助手未表现出任何症状，未与拜登有密切接触。据悉，拜登2日的核酸检测结果呈阴性。
这是白宫内部再次有人感染新冠。10月31日，美国白宫新闻秘书珍·普萨基发表声明称，自己新冠病毒检测呈阳性，由于接种新冠疫苗，只出现轻微症状，未来一段时间将居家办公。（海外网 张琪）",2021-11-05 08:54,海外网
国际,美联储何时加息？关键信号马上公布！市场都在屏息等待…,https://world.huanqiu.com//article/45SRvoA3GBG,"
美国时间周四，投资者等待即将于当地时间5日公布的10月非农就业报告并消化美联储缩减购债规模的影响，美股收盘时走势出现分化，其中纳指和标普500指数的涨幅在1%以下，道指微幅下跌0.09%。当天，医疗以及银行股普遍走低，大型科技股和芯片股走强。
其中，高通公司的股价大涨超12%，公司当天发布了季度财报，企业2021财年第四财季营收约93亿美元，和去年同期相比增长12%，高于市场此前预期。其中智能手机芯片的销量同比增长了56%。高通首席执行官表示，在供应短缺的压力下，第四季度公司将优先发展最赚钱的智能手机业务。
周三美联储宣布将开启缩减购债计划，虽然牵动市场情绪的“靴子落地”了，但是现在仍不是投资者感到轻松的时候，因为“何时加息”还悬而未决。根据美联储的政策目标，是否加息的一个关键指标为：
周四，欧洲主要三大股市集体上涨，伦敦、巴黎和法兰克福股市的涨幅都在0.5%上下。
周四，国际油价大幅下跌，截至收盘，纽约商品交易所12月交货的轻质原油期货价格下跌2.54%，并且自10月初以来首次收在80美元每桶下方；明年1月交货的伦敦布伦特原油期货价格跌幅为1.77%。周四，欧佩克+会议决定坚持目前的产量协议，今年12月将原油日产量提高40万桶。",2021-11-05 08:51,央视财经
国际,拜登五个月内二度访欧，但美欧无法再“踏入同一个大西洋”,https://world.huanqiu.com//article/45SRqH76XFK,"
10月29日，美国总统拜登开启任内第二次访欧之行，出席二十国集团（G20）峰会和《联合国气候变化框架公约》第26次缔约方大会（COP26），其间又分别与意大利、法国、德国、土耳其等国领导人会晤。虽然拜登的二次访欧与两场多边会议在欧洲召开有关，但距首次访欧时隔不足五个月，一定程度上也体现出拜登对欧洲的重视。如此频密访欧，拜登究竟有何盘算？跨大西洋关系又将走向何方？
除了参加一系列峰会及双边会晤等“规定动作”外，拜登仍想通过访欧实现三大目标。
虽然拜登任内对外策略与特朗普时期的“美国优先”有所不同，但其维护霸权的根本目标并无本质改变，只不过拜登放弃单打独斗，更重视通过多边的方式发挥所谓“榜样作用”，引领盟友和伙伴为美国外交服务。作为一直强调“规范性权力”的欧洲乐见其成，希望能够与美国共同维护西方主导的国际秩序。然而，拜登所秉持的是另类的“美国优先”，推动的是有选择的“多边主义”，只会加剧国际形势中的竞争因素，形成按议题划分的“小圈子”，增加国际社会中的对立与矛盾。
这两次事件充分显示拜登作为“最大西洋主义的总统”成色不足，欧洲盟友对拜登政府的预期降低。拜登尤其针对法国做了大量安抚工作，包括访前通电问候，再到访欧期间举行双边会晤，拜登在AUKUS议题上承认做法“笨拙”也是对法国的妥协。值得注意的是，法国将于2022年上半年接任欧盟轮值主席国，因此拜登希望稳住法国和以法德为核心的欧盟，继续在“大国竞争”的背景下拉住欧洲。
根据美国盖洛普最新民意调查结果显示，拜登上任9个月来支持率大幅下跌，平均支持率降至44.7%，成为二战后支持率下降最快的美国总统。就在访欧前，拜登本打算在国会推动通过包含气候政策等多项国内议程的支出法案，以期欧洲之行为盟友带来相关政策的确定性。然而，最终国会议员还是无法达成一致，而且民主党温和派与进步派也未能在支出法案上形成共识，导致拜登“空手”奔赴欧洲。随着2022年中期选举临近，拜登国内优先事项频频受阻，执政地位面临巨大挑战。因此，拜登也急于通过外交领域的“斩获”倒逼国内议程，以期部分缓解执政危机。
访欧之前，美欧就已在技术和贸易领域开启跨大西洋合作新篇章，在此基础上双方又在调整国际税收以及缓和贸易争端等方面取得进展。
从七国集团（G7）峰会到G20峰会，拜登推动完成全球最大税收改革，成为了任期内以制定国际规则巩固全球领导地位的第一次尝试。更为重要的是，设置全球最低税率实属美国“一箭双雕”的图谋，是拜登政府利用多边机制满足国内经济议程的需要，意在配合其为巨额基建计划筹资而推行的增税计划。
拜登上任以来对欧政策重回传统路线，跨大西洋关系出现新变化，但也存在巨大分歧与挑战，美欧同盟关系的新变局已经到来，关键在于以下三个问题。
从欧盟层面看，美国战略重心东移的事实无法改变，阿富汗危机、AUKUS都是对欧洲的“叫醒电话”，欧盟也从“战略觉醒”走向“战略清醒”。
最后，美国回来了，但欧洲又在哪里？拜登政府面临的关键问题是如何“治愈”美国以及如何“重新领导世界”。因此，拜登将会更加侧重于美国外交政策与国内政治之间的联系，其外交政策就应当为美国国内服务，根本原则就是“保护美国人民的利益”。
（孙成昊，清华大学战略与安全研究中心客座研究员；郑乐锋，清华大学战略与安全研究中心“美欧研究项目”青年研究员）",2021-11-05 08:48,澎湃新闻
国际,特朗普卸任后麻烦不断！纽约检方或对特朗普集团提新指控,https://world.huanqiu.com//article/45SQuCvdtM4,"
中新网11月5日电 据美国《华盛顿邮报》4日援引知情人士的话称，美国纽约曼哈顿地方检察官办公室为其对于特朗普集团的持续调查召集了一个新的大陪审团，以考虑是否对特朗普集团提出新的刑事指控。
资料图：美国前总统特朗普。
报道称，这一大陪审团将听取有关该公司财务行为的证据，并可能对是否提起刑事指控进行投票。
几个月前，曼哈顿地方检察官办公室在调查中召集的第一个大陪审团已经发布了起诉书，指控特朗普集团和其首席财务官艾伦·韦塞尔伯格为高管收入避税。检方在法庭上描述了一个长达15年的税务阴谋，并表示指控15项罪名，包括阴谋诈骗、共谋、重大盗窃和伪造商业记录等。不过，在该案中，所有被告均不不认罪。
《华盛顿邮报》援引的一位消息人士称，第二个大陪审团预计将审查特朗普集团如何为其房地产资产估价。
即将在今年底卸任的曼哈顿地方检察官万斯和纽约州总检察长詹乐霞的办公室一年多以来一直在关注该公司如何评估这些资产，以及它是否为相同的财产报告了不同的估价，以降低他们的税收负担和保险成本，并最大限度地提高对他们的贷款价值。",2021-11-05 08:22,中国新闻网
国际,"美""撞山""核潜艇正副舰长被解职 军方称对其""失去信心""",https://world.huanqiu.com//article/45SQqeZEviW,"
美军“康涅狄格”号核潜艇
据《华盛顿时报》消息，美国海军周三（3日）宣布，已依据第7舰队指挥官托马斯（Karl Thomas）中将的指示，解除“康涅狄格”号舰长阿尔吉拉尼（Cameron Aljilani）中校、副舰长卡欣（Patrick Cashin）少校，以及水手长罗杰斯（Cory Rodgers）的职务。海军的声明指出，将以上3人解职，是因为对他们“失去信心”。声明指出，托马斯断定，“如果有着正确的判断、审慎的决策，以及遵从航行规划、执行观察小组和风险管理的程序，本可以防止这事发生”。
美国海军在10月7日的一份声明中披露了这起碰撞事故，当时只是宣称“康涅狄格”号核潜艇处于“安全稳定的状态”。美国第七舰队在11月1日对外发表“康涅狄格”号核潜艇事故调查声明称，该潜艇在南海水域相撞的物体是“未知的海底山”。
对于这样遮遮掩掩的声明，有专家批评其“不仅缺乏诚意，且不透明、不专业，确实令人失望”。中国外交部发言人汪文斌11月2日在例行记者会上也表示，我们再次敦促美方详细说明事故的有关情况，充分回应地区国家的关切疑虑，关键是要停止派军舰军机四处滋事挑衅、炫耀武力，停止损害别国主权安全的行径，否则此类事故恐怕不会更少只会更多。（海外网 侯兴川）",2021-11-05 08:21,海外网
国际,最新！美媒：在南海“撞山”的美军核潜艇上正副指挥官等3人被解除职务,https://world.huanqiu.com//article/45SQokT7G0x,"
【环球网报道 记者 张江平】美国“海狼”级攻击核潜艇“康涅狄格号” 10月初在南海发生碰撞事故，据美国广播公司(ABC)11月5日最新报道，美国海军发表声明，已经解雇了事发时位于该核潜艇上的正、副指挥官等3人的职务。
报道称，根据美国海军的一份声明，“由于失去信心”，美国海军第七舰队司令解除了“康涅狄格号”核潜艇指挥官卡梅伦·阿尔吉拉尼、副指挥官帕特里克·卡欣和水手长科里·罗杰斯的职务。
ABC称，美方认为“康涅狄格号”核潜艇撞上的是南海海底一座未知海底山脉，美国海军第七舰队司令卡尔·托马斯认为这起事故本可以避免。
据报道，一名美国官员表示，这艘核潜艇当时没有尽可能谨慎地行驶，并且在一个海图上显示不明确的区域内行驶的速度超出了它应有的速度。
美国海军的声明还称：“合理的判断、审慎的决策和遵守航行计划的必要程序，观察舰组人员执行情况以及风险管理，本可以防止发生这起事故。”
ABC称，被解雇的3人将被一个新的“领导团队”取代。“康涅狄格号” 核潜艇在前往布雷默顿进行维修前将停留在关岛。
美国“海狼”级核潜艇“康涅狄格号” 10月2日在南海发生的碰撞事故，美国海军第七舰队发言人11月1日发表声明称，“调查确定，‘康涅狄格号’核潜艇在印太地区国际水域行动期间与一座未知海底山脉相撞 ，导致核潜艇在水下搁浅。”据美媒报道，调查结果目前已移交给美国海军第七舰队司令卡尔·托马斯进行审查，并决定是否对这一事故采取额外的追责行动。
美国《福布斯》杂志网站11月3日报道称，虽然目前这艘潜艇的损坏细节尚不清楚，但这次碰撞事故让美国海军失去了一样关键的水下作战工具，“康涅狄格号”核潜艇将至少在未来数年内无法服役，而且人们也逐渐意识到，这次事故造成的损坏可能严重到迫使这艘潜艇提前退役。",2021-11-05 08:20,环球网
国际,墨西哥度假村突发帮派枪战，至少2人死亡，游客惊恐逃离！,https://world.huanqiu.com//article/45SQYyXS9P8,"
【环球网报道】“今日俄罗斯”（RT）4日消息，当地官员证实，摩西哥一度假村当地时间4日下午突发一场帮派枪战，造成至少2名疑似帮派成员死亡。报道称，度假村客人们受到不同程度的惊吓，在工作人员的引导下逃离、躲藏至安全区域。
报道称，墨西哥金塔纳罗奥州国家公共安全秘书处官员表示，没有游客在此次事件中受重伤或被绑架。该州检察长之后也确认，这起帮派枪战发生在距离该度假村很近的海滩上。
关于事发现场，报道表示，有度假村客人描述，有一名持枪歹徒从海滩那边慢慢靠近至度假村，然后开火。还有报道称，有帮派成员突袭度假村时手持“机枪”。
报道称，美国驻墨西哥大使馆表示，他们正在对这起枪击事件进行调查。",2021-11-05 08:13,环球网
国际,哥伦比亚麦德林发生持枪抢劫 警匪当街交火,https://world.huanqiu.com//article/45SQ2NJYrh3,"
当地时间11月4日中午，哥伦比亚第二大城市麦德林发生持枪抢劫案。约20名蒙面持械劫匪闯入一家经营黄金业务公司的仓库，公司安保人员和随即赶到的警察与劫匪展开枪战。
当天晚些时候，麦德林市长办公室与警方共同证实，犯罪团伙未能得逞，警方已逮捕11名嫌疑人，缴获部分武器并扣押了多辆摩托车，警方将继续展开调查。目前官方尚未公布确切的伤亡情况，当地媒体报道，有一名警察在交火中受伤。（总台记者 高雪）",2021-11-05 07:58,央视新闻
