国际,拜登访欧结束遭弗州 “噩梦”，民主党中期选举“阴云密布”，美媒：拜登已变成“负资产”,https://world.huanqiu.com//article/45SGMATkFRT,"
【环球时报驻美国特约记者  林日】美国东部时间3日凌晨，美国总统拜登结束欧洲行回到白宫，而迎接他的是其上台以来最大的 “噩梦”——民主党在弗吉尼亚州选举中全面溃败。在新泽西州，情况也并不乐观。虽然民主党候选人墨菲勉强保住州长职位，但艰难程度远超预期。作为明年美国国会中期选举的风向标，在这两场选举中翻滚的“红色浪潮”让民主党头顶“阴云密布”。周三下午，拜登试图用自己此前“屡败屡战”的经历鼓励民主党，然而该党议员对下一步应该如何吸引选民立场依旧两极分化。民主党以及拜登能否从这场“噩梦”中醒来，尚不可知。
据《今日美国报》、美联社等媒体4日报道，在2020年拜登以10个百分点的优势赢得的弗吉尼亚州，共和党州长候选人扬金击败民主党人麦考利夫，成为该州12年以来的首位共和党籍州长。此外，共和党人西尔斯击败其民主党对手，成为弗吉尼亚州首位少数族裔女性副州长。在该州司法部负责人的选举中，民主党人赫林也向共和党人米亚雷斯认输。另据不完全统计，民主党将失去在弗吉尼亚州众议院的多数席位。在弗吉尼亚州众议院的100个席位中，共和党人预计将拿下52个席位，算上误差，也将至少获得50个议席。
在拜登去年以15个百分点优势拿下的新泽西州，各界普遍预期现任民主党籍州长墨菲能轻松获胜，因为该州的注册民主党选民比共和党选民多100万。不过在计票过程中，墨菲在大部分时间里都小幅落后于共和党对手恰塔雷利。直到美联社3日晚宣布墨菲胜出后，民主党才避免了一场“耻辱性失败”。
此外，在纽约州周二的选举中，虽然民主党人亚当斯轻松赢得纽约市长的宝座，但在长岛、拿骚县等地区，共和党却赢得多个行政职位，证明即使是在美国自由派的大本营之一，他们也能“开疆拓土”。
触目惊心——有美媒用这一词汇来形容周二选举结果对民主党的震动。《华盛顿邮报》称，从弗吉尼亚州到费城郊区再到长岛，选民们周二明确对民主党予以否定，其广度和深度甚至超过一些悲观战术家此前的预期。据《华尔街日报》报道，弗吉尼亚州和新泽西州选举是拜登上台以来面临的首次民意大考，而这两场选举的结果表明选民对民主党的领导能力感到失望，对其一些自由派政策感到担忧。英国《金融时报》评论称，弗吉尼亚州和新泽西州的选举结果对拜登来说是“致命伤”。据《洛杉矶时报》报道，有分析人士表示，拜登现在看来“软弱无力，无法兑现承诺”。《华盛顿邮报》则认为，对于参加竞选的民主党人来说，拜登已经变成“负资产”。
民主党担心这场政治“地震”将动摇国会山。据《纽约时报》报道，周二的选举让人想起了2009年。当时，共和党人赢得弗吉尼亚州和新泽西州的州长竞选，在长岛的一些地方选举中获胜，甚至在纽约市议会的竞选中也击败民主党。在第二年，他们在国会中期选举中夺回众议院。《洛杉矶时报》援引众议院共和党领袖麦卡锡的预测称，共和党在2022年的表现会比2010年更好。在2010年的中期选举中，民主党失去63个席位。
“你应在民主党选举失利中负多少责任？”据《洛杉矶时报》等媒体报道，有记者周三在白宫向拜登提出这一问题。记者还追问，是不是拜登提出的1.75万亿美元“重建得更好”社会支出法案在选举前通过，民主党人就能扭转败局？拜登并不想对民主党的失败负全责，表示弗吉尼亚州州长总是反对党这一阵营的。这名美国总统称，如果上述法案在选举举行前通过，那对民主党候选人将有所助益，但也不一定会改变结果，因为“我不确定能改变支持（前总统）特朗普的红色选区非常保守的选民”。拜登还强调，民主党的问题在于执行力，而不是其愿景。不过这名78岁的资深政治人士表示自己也多次受挫，希望以此提振民主党士气。当他离开房间时，一名记者问他有什么话要对正在就社会支出法案进行谈判的议员们说，拜登回过头来说:“把它放到我的桌子上……我相信，到下周末，在国内，我们就会看到法案通过。”
拜登可能过于乐观了，此次选举似乎并不能让民主党团结在一起。《华尔街日报》分析称，许多民主党人将他们在弗吉尼亚州的失利归咎于拜登未能让民主党的优先事项在国会获得通过。一些民主党议员迫切感到需要激励该党的核心选民，后者更希望民主党在“重建得更好”法案上达成一致。其他人则担心这样做会被视为过度自由主义。“在民主党进步派和温和派之间的争斗中，共和党赢了。”纽约州民主党前联邦众议员伊斯雷尔说。",2021-11-05 03:27,环球时报
国际,印度比哈尔邦10人因饮用假酒死亡,https://world.huanqiu.com//article/45S98nYLIH6,"
新华社新德里11月4日电（记者姜磊）据印度媒体4日报道，该国比哈尔邦当天有10人因饮用假酒死亡。
据《印度斯坦时报》报道，比哈尔邦戈巴尔根杰地区有6人死亡，西坚巴兰地区有4人死亡，另有10多人在医院接受治疗。
据报道，今年该邦已有80人因饮用假酒死亡，另有多人因此失明。
印度时常发生不法商人兜售假酒导致中毒死亡的案件，这类假酒常掺兑工业酒精。2020年7月底，印度旁遮普邦曾发生假酒案，造成100多人死亡。",2021-11-05 00:05,新华网
国际,今天台湾绿营为一个美国女人欢呼雀跃,https://world.huanqiu.com//article/45S94lz6MIN,"
今天一早起，这个消息就在中国的舆论场上广为流传，“36岁”“打破当地200多年来白人男性垄断”“创造多项历史记录”……有些自媒体以及一些人显出与有荣焉的欣喜之情。
有意思的是，台媒有关她的报道更是一片欢呼雀跃，绿营更显得兴奋。必须说，他们产生这种心情，更情有可原。吴弭的父母来自台湾，她是“台二代”，自称是“台湾的小孩”，因此在“台独”势力的口中，吴弭成了又一个“台湾之光”。
其实，不只吴弭，近些年，每次有“台二代”美国政客获任高官，绿营媒体和政客都会跳出来攀亲，公开寄希望于这些人能够在美国为台湾发声。
在吴弭当选波士顿新一任市长后，台媒都嗨了。
它们大为兴奋地称赞这是一个“历史时刻”，因为吴弭是波士顿历史上第一任女市长，同时她也是第一位“台裔市长”。
“台裔”？当然不能这么说。
当然，这并不妨碍台媒忙不迭地跟吴弭“攀关系”。
据台媒考证，吴弭曾应邀在2014年的时候访问台湾，2016年9月还担任过“台美菁英协会”波士顿分会2016年会主讲人。就是在那次演讲中，吴弭主动表示，她是“台湾的小孩”。
今年36岁的吴弭出生在芝加哥，她的父母来自台湾。
这样的“半路认亲戚”，台媒最近一年以来已经闹过好几遭了。每当有个跟台湾有点关系的美国政客露头，他们总会雀跃不已。
最典型的，当属所谓“台裔五人组”。
首先要提到的，当然是美国贸易代表戴琪。
今年以来，戴琪不断出现在我们的视线里。这也难怪，贸易代表是至关重要的内阁级别职位，主要负责执行美国的进口规则，并协调与中国和其他国家的贸易条款。
47岁的戴琪出生在美国。和吴弭一样，她的父母也来自台湾，戴琪是家族中第一个在美国出生的公民。
拜登对戴琪的介绍本来是：“她的父母在中国（大陆）出生，搬到台湾，然后到了美国，这个戴琪出生的国家。”
对前半句，台媒视若无睹，直接把戴琪夸成“台裔内阁第一人”。
被岛内视为“台湾之光”的美国“台二代”，还有国防部负责研究与工程事务的副部长徐若冰。
今年67岁的徐若冰，是五角大楼中级别最高的亚裔官员，这是亚裔美国人在美国国防部文官系统的最高纪录；同时，她也是第二位出任国防部副部长的女性。
徐若冰的地位仅次于国防部部长和国防部常务副部长，美国国防部网站介绍徐若冰是“国防部的首席技术官”，负责“确保美国军方的技术优势”。
据介绍，徐若冰是美国国家工程院院士，一直在美国军工企业部门和军界任职，在领导科技研发和管理领域拥有丰富经验。
尤其是，她在美国著名军火巨头雷神公司工作多年，曾负责管理雷神公司的电磁系统实验室，是F-35隐形战斗机一体化雷达/电子战传感器项目主管，号称F-35“雷达之母”。
奥巴马政府时期，徐若冰还曾于2012年9月至2016年1月担任美陆军部负责采购、后勤与科技事务的助理部长，是当时美陆军装备研究与采购“第一人”。
和之前几位“台二代”不同，徐若冰出生于台湾。有台媒特别强调，徐若冰10岁之前都是在台湾生活，与台湾关系“深厚”。
民进党“立委”赵天麟因此宣称，这是拜登政府“对台湾在某种程度上更大力道的支持”“未来我们在军事合作上，相信徐若冰一定可以提供很多台湾角度的需要”。
赵克露被拜登任命为美国对外广播事务的美国国际媒体署代理执行长时，台媒也颇为自嗨，直呼“台湾女儿上任”。
赵克露在台湾待的时间，比徐若冰更久一些。
她毕业于台湾政治大学新闻系，之后去美国读硕士。她在美国之音工作超过20年，还担任过美国之音代理台长。美国之音的对华报道是个什么调性，不说，大家也都知道。
在拜登的国家经济委员会中，有一位“台二代”的面孔。
49岁的哥伦比亚大学教授吴修铭在国家经济委员会担任总统科技与竞争政策特别助理。作为互联网法律与政策专家，他对科技巨头垄断问题立场强硬。
据报道，吴修铭的祖父是日据时期的官僚，他的父亲吴明达出生于台南。吴明达一直鼓吹“台独”，在留学加拿大后赴美任教，当时就开始推动海外“台独”运动，并曾回到多伦多担任加拿大“台独联盟”主席。
台媒还挖出，吴修铭常在夏天时回台湾，住在亲戚家，他有不少台湾亲戚在岛内从政，多数代表民进党参选。
去年，吴修铭曾给《纽约时报》投稿称，特朗普禁用TikTok的政治动机虽然可疑，但大陆借着这些媒体输出“网络民族主义”违反“网络开放原则”，“这一不公平现象不该再被容忍……”
一些台媒兴奋了，认为自己总算找到了吴修铭以后不会让Tik Tok日子好过的证据。
最后一位出场的，是被提名为驻联合国改革与管理事务代表，等同大使身份的卢沛宁。
新泽西州出生的卢沛宁在政治上出道较早。
他在哈佛法学院深造时与奥巴马是同学，后来还与奥巴马夫妇同在盛德律师事务所工作，是奥巴马参选总统时所依赖的“哈佛帮”核心人物，曾担任过奥巴马时期的劳工部副部长。
他和奥巴马的亲密关系，恐怕也是拜登邀请他再度出山的原因之一。
不过，卢沛宁和台湾的关系相对要远一点。他的父母出生于大陆，后到台湾生活，上世纪50年代就远赴美国留学了。
近20年来，美国政界出现不少有台湾背景的官员、议员。
曾任美国交通部长、劳工部长的赵小兰，如今仍对美国政治具有一定影响力。和赵小兰差不多，2020年美国总统大选民主党初选候选人杨安泽，他的父母也是从大陆到台湾，再移民美国的。
“台二代”，已经在美国政坛上渐露头角。
1998年，吴振伟在俄勒冈州当选，成为美国史上第一位台湾出生的国会议员。
国会众议院后来又迎来纽约州的孟昭文和加州的刘云平两名议员，陈筱玲成为得州州众议员，邱信福当选加州州众议员。
有意思的是，每次有“台二代”在美政坛获任要职，都会引起岛内绿营媒体和政客的欢呼。他们拼命拉关系，显然是期待这些所谓“台湾之光”能在“挺独反中”方面有所表现。
美国“台籍”群体中，确实一部分人有 “挺独”倾向。
这首先有历史原因，与赴美台湾人的过往经历有关。
有人梳理赴美台湾人的谱系。首波大量移民潮是在战后初期，尤其1949年国民党败逃台湾岛前后。日据时期的殖民地教育，使这一波赴美台湾人与美国其他华侨群体语言不通，形成相对独立的群体。
不过，当时两岸在美华人仍在共享“华裔”标签，还没出现有明显分裂倾向的所谓“台裔”或“台湾认同”。
紧接着是1960年代开始，因为台湾经济起飞和高等教育蓬勃发展，也因本省人在国民党统治下发展受限，不少人选择赴美留学深造。
大量知识分子落地生根，使“台籍”移民在美国少数群体中总体素质较高。至今，“台籍”侨民仍是美国生活水平和教育程度较高群体之一。
这时候，其中一些人，尤其是因国民党统治而被迫离台的，开始有意无意地把反国民党和反对“中国”等同起来。
比如，部分在美“台籍”侨民，当时常以“台湾”名义组织起来，跟国民党以“中华”名义的其他组织对抗，争夺所谓的代表权。
这种政治倾向后来进一步演化，开始与在美“台独”势力产生勾连，并传给了一些后来在美国政坛活跃的“台二代”。
除了历史成因，当然也有岛内“台独”势力顺势拉拢的现实因素。
随着部分在美“台籍”、尤其个别“台二代”“挺独”倾向加剧，民进党当局上台后试图利用这个趋势，将这部分人作为发展对美经贸和政治关系的桥梁。蔡英文上台后，尤其重视这方面工作。
如此一来，岛内“台独”就与在美“挺独”势力形成苟合，相互利用。
美国“挺独”势力中，首先就有前面提到的部分“台二代”政客。他们一方面继承了父辈们的一些“挺独”倾向，另外也将在美“台籍”侨民去替你视为想当然的票仓，为了选票主动迎合他们的“对台情愫”。
回看过去几十年，美国部分“台籍”移民“挺独”倾向的形成和发展，已经再清晰不过了。
不过，这部分人绝非在美台湾人的主流。
为了政治上平步青云，一些“台二代”美国政客或许利用“台湾背景”，但岛内“台独”政客和媒体每次都努力攀亲，寄望于这些人日后能够“为台发声”，又显然太幼稚了。
不要忘了：
这一点，连一些台湾网友都清楚看到了。
不管什么血统，他们首要顾及的是美国利益，而不是为台湾谋福利。
况且，在美华裔群体构成复杂，既有大陆和港澳过去的，也有东南亚国家华裔过去的，其中大多数人在涉台问题上并无“挺独”倾向。即便是从台湾过去的，主流政治倾向也非“挺独”。
一些“台二代”美国政客私底下或许持有反华分裂立场。他们登上美国政坛一些关键岗位，对我们当然不是好事，对两岸关系也会带来潜在挑战。
但他们又绝不会像岛内“台独”势力期盼的那样，“勇敢为台出头”。
打不打或怎样打“台湾背景”这张牌，都取决于政治私利的权衡。",2021-11-05 00:03,环球时报新媒体
国际,俄罗斯总统普京和白俄罗斯总统卢卡申科签署联盟国家一体化法令,https://world.huanqiu.com//article/45S84tbFQ9L,"
当地时间11月4日，俄罗斯总统普京和白俄罗斯总统卢卡申科签署联盟国家一体化法令。（总台记者 王斌 宋一平）",2021-11-04 23:35,央视新闻客户端
国际,联合国环境署：多数国家适应气候变化资金不足,https://world.huanqiu.com//article/45S7uOyviOt,"
联合国环境规划署当地时间11月4日发布了《2021年适应差距报告：风暴前夕》。报告指出，尽管气候适应的相关政策和规划数量不断增加，但实际的融资和实施进展仍然远远没有达到所需的水平。多数国家都没有利用好新冠疫情后的经济复苏机会，未能实现在优先推进绿色经济增长的同时，加强对于干旱、风暴和野火等气候影响的适应能力。
根据《巴黎协定》下各国当前的承诺，截至21世纪末，全球气温很可能至少上升2.7℃。即使世界兑现了《巴黎协定》的理想目标，成功将全球升温限制在1.5℃或2℃以内，许多气候风险仍不可避免。提高气候适应能力，特别是在融资和实施方面制定更雄心勃勃的目标，将有效防止现有差距进一步扩大。报告发现，仅发展中国家，2030年前的适应成本极有可能达到每年1400至3000亿美元这一预期区间的上限估值，2050年前达到每年2800至5000亿美元的上限估值。2019年，发展中国家获得的用于规划和实施气候变化减缓和适应的气候资金为796亿美元。总体而言，预计发展中国家的适应成本是当前公共气候适应资金流的5至10倍，而且差距仍在扩大。同时，特别是在发展中国家，鉴于偿债成本上升，政府收入减少，政府未来在气候适应领域的支出可能会面临困难。
联合国环境规划署执行主任英厄·安诺生（Inger Andersen）表示：“世界正致力于加大温室气体减排力度，但努力还远远不够。与此同时，各国还必须大幅提升适应气候变化的努力。即使我们当下关闭了所有温室气体排放的开关，阻断所有碳排放，但气候变化的影响却还会在未来几十年中伴随着我们。我们需要在气候适应的融资和实施方面实现变革，制定更雄心勃勃的目标，从而显著减少气候变化对我们造成的危害和损失。我们需要即刻行动。”（总台记者 杨琼）",2021-11-04 23:31,央视新闻客户端
国际,白俄罗斯外交部召见波兰临时代办 抗议边境局势升级,https://world.huanqiu.com//article/45S66VT7zOa,"
白俄罗斯国家通讯社当地时间11月4日报道称，当天白俄罗外交部召见了波兰驻白俄罗斯临时代办马丁·沃伊谢霍夫斯基，就近期两国边境局势升级提出严正抗议。沃伊切霍夫斯基被告知，白俄罗斯从未挑起也无意挑起边境事件，白方不允许波方不负责任地加剧边境局势。与此同时，白俄罗斯方面重申愿意本着相互尊重的对话精神解决任何问题，包括敏感问题。
同一天，白俄罗斯外交部发表声明称，华沙方面毫无根据、令人震惊地加剧边境紧张局势的行为令人震惊。声明称，11月2日波兰官员就某位身份不明的“穿制服的武装人员”从白俄罗斯领土“进入”波兰发表了声明，白方认为该声明毫无事实根据，完全是谎言。白俄罗斯外交部在声明中指出，“令人担忧的是，波兰针对白俄罗斯的挑衅在波兰社会、欧盟以及整个北约中营造好战氛围”。（总台记者 王斌 王晋燕）",2021-11-04 22:40,央视新闻客户端
国际,中国政府中东问题特使翟隽同苏丹外交事务负责人萨迪克通电话,https://world.huanqiu.com//article/45S57RmWDEl,"
2021年11月4日，中国政府中东问题特使翟隽同苏丹外交事务负责人萨迪克通电话。
萨迪克向翟隽特使通报了苏丹国内局势最新发展，感谢中方为苏丹政治过渡进程和经济社会发展提供的宝贵支持，希望中方继续在苏丹问题上发挥积极作用。萨重申苏方高度重视发展对华关系，愿继续同中方密切沟通协调，推动两国关系取得新发展。
翟隽表示，中方关注苏丹局势最新发展，希望苏丹保持和平稳定，愿继续同苏方保持沟通与协调，为推动苏政治过渡进程发挥积极作用。中方反对外部势力干涉苏丹内政，相信苏丹人民有智慧、有能力处理好内部事务，解决好自己的问题。中方主张通过对话协商解决问题，支持苏丹有关各方以人民的根本利益为重，在《宪法宣言》和《朱巴和平协议》框架下深入开展对话，捐弃前嫌，凝聚共识，为下阶段推进政治过渡奠定牢固基础，积累有利条件。中方呼吁国际社会为支持苏丹政治过渡提供更多“正能量”，支持“苏人所有、苏人主导”的政治过渡进程，支持苏各派通过对话加强团结、解决分歧，帮助苏丹克服经济社会发展困境，提供更多人道主义援助。
翟隽表示，中苏是相互理解、平等相待的好朋友、好伙伴、好兄弟。两国建交62年来，双边关系始终健康稳定发展。中方愿同苏方携手努力，不断深化两国各领域交流与合作，开辟中苏关系发展新前景。",2021-11-04 22:13,中华人民共和国外交部
国际,新西兰为呼吁民众打疫苗，喊出几名黑帮头目录视频号召接种,https://world.huanqiu.com//article/45S4b18T8Jp,"
【环球网报道】据《纽约邮报》当地时间11月3日报道，新西兰近日为呼吁民众打疫苗，喊出了该国多个黑帮头目拍视频来敦促民众接种。视频中黑帮头目们纷纷表示自己已经完成了接种，并呼吁民众一起去接种疫苗。有黑帮头目在视频中表示，自己已经接种过疫苗，“我希望你也这样做。”还有黑帮头目呼吁，为了自己的社区也一定要打疫苗。",2021-11-04 21:58,环球网
国际,不到20分钟的行程也要坐私人飞机？俄媒：欧盟委员会主席被控“生态犯罪”,https://world.huanqiu.com//article/45S4UAKuBT6,"
【环球网报道】不到20分钟的行程也要坐私人飞机，“今日俄罗斯”（RT）4日报道称，随着各国越来越关注气候变化问题，欧盟委员会主席冯德莱恩正因为几个月前的一次举动面临外界批评。
RT称，今年6月，冯德莱恩乘坐私人飞机从奥地利首都维也纳飞往斯洛伐克首都布拉迪斯拉发，飞行距离约为50公里。报道援引德媒消息称，这场飞行只持续了19分钟。
因为这趟行程，冯德莱恩成了被调查的对象。
报道称，欧洲纳税人协会（TAE）秘书长迈克尔·耶格尔告诉德媒，冯德莱恩的短暂飞行是“生态犯罪”（an ecological sin）。
“这花费了纳税人很多钱，（她也）花费了很多时间往返机场，最重要的是——（损害了）很大的公信力，”耶格尔批评说。
报道称，这一消息是《联合国气候变化框架公约》第二十六次缔约方大会（COP26）举行期间被爆出的。
RT称，与火车、公交车或汽车相比，乘飞机出行会产生更多的二氧化碳排放量。德国议员贾娜·施姆克表示，冯德莱恩推动欧洲在2050年之前实现碳中和，她应该在应对气候变化问题上“树立榜样”。“否则，你就会给人们留下不值得信任的印象。”
不过报道称，欧盟委员会的一位发言人为冯德莱恩6月的行程做了辩护，称她必须在两天内穿越7个国家。“我们研究了其他选择，但在后勤上没有其他选择。”这位发言人还提到了对航班和铁路服务受到新冠限制措施影响的担忧。",2021-11-04 21:55,环球网
国际,苏丹武装部队总司令布尔汉同意释放部分被拘留者,https://world.huanqiu.com//article/45S4MAAdyja,"
据阿拉比亚电视台当地时间11月4日报道，来自南苏丹调解人的消息称，斡旋双方没有谈及回到10月25日之前状态，但接近达成共识。苏丹各方就目前苏丹政局危机已达成协议，预计4日宣布结果。此外，苏丹武装部队总司令布尔汉同意释放部分被拘留者。（总台记者 吴爱民）",2021-11-04 21:51,央视新闻客户端
