国际,巴西总统博索纳罗接受质询 否认对联邦警察局进行政治干预,https://world.huanqiu.com//article/45SLOtblKuF,"
据巴西媒体报道，当地时间11月3日晚间，在最高法院法官亚历山大·德·莫赖斯的要求下，巴西总统博索纳罗就涉嫌对联邦警察局的工作进行政治干预一事，在总统府接受联警质询。博索纳罗否认利用职权干预联警工作。
巴西前司法和公共安全部长塞尔吉奥·莫罗曾指控总统博索纳罗更换巴西联邦警察局局长的做法涉嫌干涉司法。2020年4月下旬，博索纳罗撤掉西奥·瓦莱索（Maurício Valeixo）的巴西联邦警察局局长职务后，随即任命时任巴西情报局局长亚历山大·拉米奇（Alexandre Ramagem）担任这一职务，但巴西最高法院在拉米奇即将举行就职典礼之前临时决定暂停拉米奇的任命和就职。据当地媒体报道，拉米奇与博索纳罗一家人私交甚好。莫罗向警方提交了手机中与总统博索纳罗的信息往来，还陈述了博索纳罗具体如何干涉联邦警察局工作，以及如何妨碍联邦警察局对博索纳罗家人的调查。目前巴西最高法院正就该指控对总统博索纳罗进行司法调查。
博索纳罗表示，他对西奥·瓦莱索的工作表现并没有不满或对其缺乏信心，之所以让莫罗撤掉西奥·瓦莱索巴西联邦警察局局长一职，是因为瓦莱索与他缺乏沟通。他从未试图从自己指定的联邦警察局局长处打探调查案件的相关信息，或者直接从联警处取得调查报告。
此外，博索纳罗目前还需就另一项针对他及多名政客的指控接受取证，具体指控包括“在社交媒体平台上发表与选举相关的虚假新闻、使用公共资金资助网络水军散布言论破坏巴西民主法治”等。（总台记者 徐丹娜）",2021-11-05 05:48,央视新闻客户端
国际,巴西总统博索纳罗接受质询 否认对联邦警察局进行政治干预,https://world.huanqiu.com//article/45SLOtblKuF,"
据巴西媒体报道，当地时间11月3日晚间，在最高法院法官亚历山大·德·莫赖斯的要求下，巴西总统博索纳罗就涉嫌对联邦警察局的工作进行政治干预一事，在总统府接受联警质询。博索纳罗否认利用职权干预联警工作。
巴西前司法和公共安全部长塞尔吉奥·莫罗曾指控总统博索纳罗更换巴西联邦警察局局长的做法涉嫌干涉司法。2020年4月下旬，博索纳罗撤掉西奥·瓦莱索（Maurício Valeixo）的巴西联邦警察局局长职务后，随即任命时任巴西情报局局长亚历山大·拉米奇（Alexandre Ramagem）担任这一职务，但巴西最高法院在拉米奇即将举行就职典礼之前临时决定暂停拉米奇的任命和就职。据当地媒体报道，拉米奇与博索纳罗一家人私交甚好。莫罗向警方提交了手机中与总统博索纳罗的信息往来，还陈述了博索纳罗具体如何干涉联邦警察局工作，以及如何妨碍联邦警察局对博索纳罗家人的调查。目前巴西最高法院正就该指控对总统博索纳罗进行司法调查。
博索纳罗表示，他对西奥·瓦莱索的工作表现并没有不满或对其缺乏信心，之所以让莫罗撤掉西奥·瓦莱索巴西联邦警察局局长一职，是因为瓦莱索与他缺乏沟通。他从未试图从自己指定的联邦警察局局长处打探调查案件的相关信息，或者直接从联警处取得调查报告。
此外，博索纳罗目前还需就另一项针对他及多名政客的指控接受取证，具体指控包括“在社交媒体平台上发表与选举相关的虚假新闻、使用公共资金资助网络水军散布言论破坏巴西民主法治”等。（总台记者 徐丹娜）",2021-11-05 05:48,央视新闻客户端
国际,“简史三部曲”作者赫拉利接受《环球时报》专访：“科技冷战”会带来灾难性后果,https://world.huanqiu.com//article/45SL3s3mW3a,"
【环球时报记者  白云怡  李艾鑫】新冠肺炎疫情肆虐近两年来，“简史三部曲（《人类简史》《未来简史》《今日简史》）”的作者、耶路撒冷希伯来大学历史系教授尤瓦尔·赫拉利一直在思考“冠状病毒之后的世界”将是什么样。他在一些国际媒体上撰文，表达对一些国家在应对全球性危机时各自为战的担忧。赫拉利11月初接受《环球时报》记者专访时表示：“我们缺乏的是与之相应的政治智慧。”赫拉利认为，“新冷战的危险正在增长，这也将是一场“科学和数字冷战”，他希望这场疫情大流行的教训向人们展示出科学被政治化是多么危险。赫拉利说，人类现在面临的许多挑战都只能通过全球合作来解决，而“中国作为世界的领导者之一，其参与的合作对世界影响巨大”。值得一提的是，被改编成知识漫画系列的《人类简史：人类的诞生》《人类简史：文明的支柱》相继出版，赫拉利坦言，希望这种全新方式的书可以激励更多人对现实进行批判性和全球性的思考。
然而，我们缺乏的是与之相应的政治智慧。疫情暴发已经快两年了，我们仍然没有一个全球性的行动计划，在世界范围内阻止疫情并应对疫情引发的后果。科学家是制造工具的人，但决定如何使用工具的人是政治家，他们没有作出明智的决断。所以我说，我们的科学力量和我们的政治局限之间存在着严重的不平衡。
我们需要全球合作来应对新冠肺炎，我们更需要全球合作来应对21世纪其他重大挑战，它们甚至比新冠病毒更加复杂——比如像人工智能这样颠覆性技术的兴起，它蕴含着巨大的希望，但对人类也意味着重大的潜在风险。确保这项技术被用于善意而非邪恶目的的唯一方法就是通过一项全球性的监管协议。倘若我们今天无法在应对新冠肺炎疫情的问题上合作，那么明天在人工智能领域的合作岂不是更加困难重重？
然而，相信编造的故事而非真相是很危险的。我希望，未来人类不仅能发展出更高的科技力量，也能更加信任科学——仅有前者是不够的。这也是我们为什么把《人类简史》改编成漫画的原因：为了让更多人读到它。科学和历史的最新发现和每个人都息息相关，但并不是每个人都喜欢阅读科学类的书籍。因此，我们也在寻找全新的方式来讲述科学和历史。我们的主题依然是严肃的，有时甚至是悲剧的，但构建故事的方式有所不同。
我认为今天的情况实际上已比50年前或100年前有所进步。我希望这场大流行的教训向人们展示出科学被政治化是多么危险。一旦开了把科学政治化的头，人们就再也不相信事实了。即使他们现在再被告知真相，他们也会充满了怀疑。我们看到，同样的情况已经发生在气候变化议题上，我们现在面临很多困难，因为在过去许多年中，人们已拒绝相信科学模型和事实。
我希望，所有现在试图把科学政治化的人都能看到在应对新冠肺炎疫情和气候变化领域的教训。也许，用政治扭曲科学真理可以让你获得短期的利益，但从长远来看，这种做法对你和整个人类来说都是极具破坏性的。
全球不平等的加剧体现在许多方面。如我们可以看到，自动化革命和人工智能革命是由极少数国家领导的，而大多数国家被远远甩在后面。这是一种潜在的风险：或许我们将再次经历曾发生在工业革命期间的事情。19世纪时，少数国家率先实现工业化，他们通过火车、轮船、现代武器等现代化工业获得巨大力量，并用它来征服与剥削世界上的其他地方。这些极少数的国家主要是西欧、美国以及后来的日本等，而其他国家花了一个多世纪才逐步缩小和前者的差距。现在，随着人工智能、机器人、生物技术等远比蒸汽机和火车更强大的新力量的发展，上述情况可能再次发生——为数不多的几个国家可能统治整个地球。但这一次，国与国间的差距或许将无法再次缩小，因为21世纪新技术的一个特点是，它们将有利于把权力集中在一个非常小的地方，集中在非常少的人手中。
在历史上的大部分时间里，土地是最主要的权力来源，但土地无法集中在一个地方。过去两个世纪，工业的发展让权力集中变得更加容易。然而，我们仍然不可能真的把所有的工厂、机器和矿山集中在同一个地方。今天，世界上主要的权力来源成为数据、信息以及分析这些数据和信息的能力。信息可以被集中在同一个地方、同一个国家，甚至同一个公司。或许，这将使我们迎来比人类历史上任何时候都更大的不平等。
但我们可以有不同的选择，我们可以认识到合作是应对这场疫情的最佳方式。我们需要和他国合作，信任它们，和它们分享信息，一起制定全球计划，而不是责备和“甩锅”它们。如果我们这么做，应对大流行将容易得多。而且，它还将创造一个更加和谐与和平的世界，将使我们更容易应对未来的挑战，无论是气候变化还是人工智能的兴起。归根结底，真正影响到我们的不是大流行，而是我们的选择。",2021-11-05 05:39,环球时报
国际,法国作家呼吁公正对待中国请愿被删除 联署人：证明“言论自由”虚伪性“太棒”的案例,https://world.huanqiu.com//article/45SAqiD4mQ2,"
【环球时报记者 刘欣 陈青青 范凌志】当地时间11月2日，法国知名作家、时政评论家、记者马克西姆·维瓦斯在公益网站Change发起一项请愿，在请愿书中，他痛陈自己近年来因客观、公正评价中国而招致的诽谤和侮辱，呼吁社会各界“尊重中国就像尊重我们自己一样！”然而，《环球时报》记者发现，维瓦斯4日在个人社交媒体表示，该请愿书已经被Change网站审查，“他们告诉我，此请愿书不可见，要么是因为链接错误，要么是因为请愿书违反了社区准则，或者请愿书是被作者自己删了。”
维瓦斯曾两次赴新疆考察，历经4年著书《维吾尔族假新闻的终结》，并于2020年年底由法国丝路出版社正式出版发行。在这本书中，他从专业记者视角揭露美国国家民主基金会（NED）、“世界维吾尔代表大会”（世维会）和“人权观察”组织如何制造并传播诸如“种族灭绝”“关押百万维吾尔族人”等涉疆谣言。
在2日发起的请愿书中，维瓦斯表示自己曾被谩骂“中国人的笔锋和鹦鹉”“阴谋家”“白痴”，当时请愿已经收到超过150位世界各地各界人士的实名联署，联署人来自中国、法国、比利时、瑞士、加拿大、黎巴嫩等多个国家，他们的职业也非常多样，涵盖社会学、建筑、外交等多个领域。
对于自己的请愿被莫名其妙地删除，维瓦斯4日对《环球时报》记者表示，Change网站是一家美国网站，“这对我们不利，对他们更不利，因为我们会不停的讨论（被删）这件事儿，他们不仅在中国撒谎，而且还想阻止我们说出来。”他表示，他在legrandsoir.info 网站上也发布了这则请愿，要继续和 Change网站进行斗争。不仅仅是美国的联署网站对这样的呼吁视而不见，记者发现，法国的主流媒体也对维瓦斯发出的希望公众对中国公正看待的声音装聋作哑，几乎没找到任何相关报道。
参与联署的学者之一，复旦大学中国研究院研究员、太和智库高级研究员郑若麟告诉《环球时报》记者，这是一个展示所谓“言论和新闻自由”虚伪性“太棒”的案例。
“我要向全世界传达这样的信息，那就是无论何时何地，谎言都是为侵略战争准备的，而战争的第一个受害者就是真相。”维瓦斯说：“这就是为什么我想展示中国的另一面给更多的朋友，打击那些讽刺中国并阻止我们充分了解这个拥有千年文明伟大国家的假新闻。中国正在与美国竞争，但中国绝对不是法国的敌人。我们必须把中国当作伙伴和朋友。”",2021-11-05 05:38,环球时报
国际,驻丹麦使馆发言人就北约秘书长斯托尔滕贝格无端抹黑攻击中国发表谈话,https://world.huanqiu.com//article/45SKzEhlH0J,"
日前，在丹麦访问的北约秘书长斯托尔滕贝格无中生有地大肆抹黑攻击中国，渲染所谓“中国威胁”。他的言论充满冷战思维和意识形态偏见，违背和平、发展、合作的历史潮流。
中国始终是世界和平的建设者、全球发展的贡献者、国际秩序的维护者、公共产品的提供者，将继续以新的发展为世界提供新机遇，为世界和平与发展做出更大的贡献。中国坚定奉行防御性国防政策，中国发展必要的军事能力完全是为了维护自身正当的国家安全利益。中国力量的增长是世界和平力量的增长。任何国家只要无意威胁和损害中国主权、安全和领土完整，都不会受到中国国防力量的威胁。
我们奉劝全球最大军事联盟的秘书长斯托尔滕贝格先生以客观、开放的态度看待中国发展，多做有利于维护国际和地区安全与稳定的事。",2021-11-05 05:37,中国驻丹麦大使馆
国际,举行全球规模最大核战略演习，美国却渲染“中国核威胁”，美媒：报告助长反华议员的冷战废话,https://world.huanqiu.com//article/45SJ2DnqOgn,"
【环球时报驻美国特约记者 林 日  环球时报记者 郭媛丹 陈 欣】当地时间3日，美国国防部公布2021年度《中国军事与安全态势发展报告》，即中国军力报告。“这份报告同以往类似报告一样，罔顾事实、充满偏见。”正如中国外交部发言人汪文斌所说，五角大楼竭力在报告中描述了一幅中国“扩张核武库”的速度远快于预期的“危险”场景，还花不少篇幅说明解放军打算如何获得“武力犯台”的绝对优势。当天，美国参谋长联席会议主席米利称，美国“绝对有能力保卫台湾”，被媒体当作解读这份报告的重要注脚。不论是对中国核武力量，还是对台湾问题，美国近来发声越来越多，调子也越来越高。渲染“中国威胁”的美国，正成为严重损害全球战略稳定、破坏国际和平与安全的危险因素。
美国通常在9月公布中国军力报告，今年的报告差不多延迟了两个月。美国国防部网站称，报告提供了有关中国国家战略、外交政策目标、经济计划和军事发展的背景。美国防长奥斯汀在推特上的解释更清晰地表露出美方意图。他说：“报告展示了应对中国步步紧逼的威胁的重要性。”
这份长达192页的报告极力渲染奥斯汀所说的“中国威胁”。报告称，中国海军是世界上最大的海军，陆军目前拥有最大规模的现役军队，空军为世界第三大空军。“中国在与世界级军事强国竞争方面的雄心非常明确。”
“美国之音”报道说，今年的军力报告新增了有关中国在生物和化学武器方面的内容。报告声称，中国从事具有潜在双重用途的生物活动，引起对中国是否遵守国际公约的质疑。“德国之声”称，美国国防部担心，中国试图在海外建立更可靠的后勤和基地网络。报告说，一旦中国建成一个全球性军事后勤网络和军事设施，就可能会干扰美国的军事行动，并为其发动反美攻击性行动提供支持。而对于美国没有在一份“军力”报告中提及新冠肺炎疫情，《纽约时报》竟称“这令人惊讶”。
这份报告最核心，也引起媒体关注最多的部分是其有关中国核力量的描述。报告称，中国正在继续加强战略核武库建设，到2027年，中国可能拥有700枚可交付使用的核弹头，三年后这一数字将达到至少1000枚。报告还警告，随着拥有陆基洲际弹道导弹、潜射弹道导弹以及战略轰炸机三种核打击方式的能力，中国可能已经建立新“三位一体”核力量。美国防部称，未来10年，中国的目标是使核力量现代化、多样化并予以扩大。
美国广播公司评论说，五角大楼报告预测的中国导弹增长幅度与去年的报告有很大不同。去年的报告认为，中国现有200枚核弹头的核武库将在2030年增加一倍。英国路透社称，这一规模仍将明显小于美国目前3750枚核弹头的核武库，但华盛顿一再呼吁中国加入美国和俄罗斯的新军控条约。而根据有关国际智库的数据，截至2021年初，美国实际拥有5550枚核弹头。
上海全球治理与区域国别研究院研究员鲁坦4日对《环球时报》记者说，美国炒作中国核力量，意在给自身“核松绑”。逐步放松对核武器研发、使用或扩散方面的诸多限制，是美国现阶段的国策，也符合美国军工复合体的巨大利益诉求。“事实上，美国才是全球最大的核威胁来源。”汪文斌4日就美方报告回应说，任何国家只要不对中国使用核武器，都不会受到中国核武器的威胁。
“德国之声”报道说，这份报告是基于美国国防部截至2020年所收集的信息，没有提到上个月米利对所谓“中国进行高超音速武器试验”的担忧。但周三报告发布前，米利在阿斯彭安全论坛上称，中国的高超音速导弹试验和其他进展证实了国际社会所面临的“危险”。《纽约时报》说，这名美国军方最高官员称，他将中国视为美国的“头号”军事挑战。
引起媒体更多关注的是米利有关台湾的说法。他称自己不认为中国大陆会在6个月、12个月或24个月内攻打台湾，但毫无疑问中国大陆正在建构攻台能力。在被问到美国是否有能力“保卫台湾”时，米利说：“我们绝对有能力在世界各地做各种事情，如果需要的话，也包括保卫台湾在内。”《纽约时报》评论称，米利说，前提是美国政治领导人决定这样做。这是一个非常重要的前提。任何一位美国总统做出这样的决定都将是巨大转变。
米利的说法与美国防部的中国军力报告相互呼应。台湾《联合报》报道说，在本年度的报告中，五角大楼花了不少篇幅说明大陆对台湾的“文攻武吓”，并预设2027年是“台海危机最高峰”的未来时刻，称解放军的短期目标就是在那时获得“武力犯台”的绝对优势，以迫使台湾按照大陆的条件进行谈判。3日与米利参加同一论坛的美国众议院情报委员会主席亚当·希夫则更激进。他声称，美国需要更明确地表达保卫台湾的义务。
“美方一段时间以来涉台消极错误言行不断，助长‘台独’分裂势力嚣张气焰，助推了台海局势紧张。”汪文斌4日敦促美方把一中政策真正落实到行动上，而不是说一套做一套。
美国Counterpunch网站评论称，是时候让米利靠边站了，他对中国测试高超音速武器的评论骇人且夸张。在过去一年，美国国防部还发表一系列夸大中国“威胁”的声明，以增加国防开支。防长奥斯汀也应该被解雇。他在国会山的简报和五角大楼的中国军力报告一样，都是典型的“最坏情况报告”，助长了科顿、克鲁兹、卢比奥等这类反华议员的冷战废话。
据了解，美国截至目前只出过4个国家的军力报告，分别是苏联、中国、朝鲜和伊朗。上世纪80年代，美国每两年发布一次有关苏联的军力报告。朝鲜军力报告和伊朗军力报告分别从2010年和2011年开始，但篇幅比较小，也并非定期发布。而中国军力报告自2000年发布以来，除一年没有外，每年定期发布，篇幅越来越长，论述越来越细。有军事专家在谈到这种趋势时对《环球时报》记者说，该报告对打造“中国威胁论”发挥了很大作用。
就在五角大楼大肆渲染“中国核力量威胁”之际，美国正举行“全球雷霆22”大规模核战略演习，内容包括轰炸机飞行、导弹操控人员训练和战略核潜艇战备，验证“核三位一体”的可靠性和弹性等。军事专家宋忠平4日对《环球时报》记者说，能在全球范围内组织这样的演习，美国是独一份。演习的目标非常明确，那就是震慑对手，针对中俄打造更强大的核力量。
美国不仅制造核威胁，还将更多国家拉入危险的小圈子。“德国之声”4日报道说，拜登政府正在对美国的核政策进行全面审查，目前尚不知对中国的担忧会如何影响美国的核政策，但预计美将针对美英澳核潜艇合作推出进一步计划。另一盟友日本则紧跟五角大楼的炒作步伐。日本内阁官房长官松野博一4日说，中国的军力动向对日本而言是极其重大的关注事项，“我们将与相关国家携手，呼吁中国提高包括核政策在内的军力透明度，并遵守国际行动规范”。",2021-11-05 04:42,环球时报
